{
  "$schema": "../../schemas/command.schema.json",
  "id": "resume",
  "actionId": "aaa:resume",
  "workflowId": "implement-change",
  "arguments": {
    "type": "object",
    "properties": {
      "request": { "type": "string", "minLength": 1 }
    },
    "required": ["request"],
    "additionalProperties": false
  },
  "result": {
    "type": "object",
    "properties": {
      "status": { "type": "string" },
      "workflowId": { "type": "string" },
      "artifacts": { "type": "array" },
      "diagnostics": { "type": "array" }
    },
    "required": ["status", "workflowId"],
    "additionalProperties": false
  },
  "presentation": {
    "label": "Resume",
    "help": "Resume from verified durable workflow state."
  }
}
