{
  "$schema": "../../schemas/command.schema.json",
  "id": "improve-skill",
  "actionId": "aaa:improve-skill",
  "workflowId": "improve-skill",
  "arguments": {
    "type": "object",
    "properties": {
      "request": { "type": "string", "minLength": 1 }
    },
    "required": ["request"],
    "additionalProperties": false
  },
  "result": {
    "type": "object",
    "properties": {
      "status": { "type": "string" },
      "workflowId": { "type": "string" },
      "artifacts": { "type": "array" },
      "diagnostics": { "type": "array" }
    },
    "required": ["status", "workflowId"],
    "additionalProperties": false
  },
  "presentation": {
    "label": "Improve skill",
    "help": "Run baseline, change, evaluation, and qualification for a skill."
  }
}
